{
  "dispatch_id": "fix-review-chain-bugs-20260616",
  "source_master_plan": "plans/gd/2026-06-16-fix-review-chain-bugs/master-plan.md",
  "goal_chain": {
    "PROJECT_GOAL": "在 Claude Code 中建设 /gd Goal-Driven 多 Agent 主链路，提升复杂任务的计划、审查、执行、验收效率，并通过 Codex 作为 cross-review sidecar 降低填表式计划与执行遗漏风险。",
    "CHAIN_GOAL": "用 shared core 固定目标链、SC、任务包、review contract 和 anti-fill 标准，保证后续 /gd command、multi-agent dispatch、execution review、Codex cross-review 都引用同一套契约。",
    "PHASE_GOAL": "为 GD 审查链路 33 个 fail-open/放水类 bug 生成可执行修复计划套件，按链路分桶（共享组件+传输 / L3-only / L2），child planner 只产计划草稿不改源码。"
  },
  "max_parallel_planning": 2,
  "max_parallel_execution": 2,
  "max_parallel_review": 2,
  "max_parallel_validation": 2,
  "tracks": [
    {
      "track_id": "t1-shared-infra",
      "mode": "plan",
      "agent_role": "child_planner",
      "owned_paths": [
        "plans/gd/2026-06-16-fix-review-chain-bugs/proposals/shared-infra"
      ],
      "forbidden_paths": [
        "/Users/praise/.claude/**",
        "plans/gd/2026-06-16-fix-review-chain-bugs/proposals/l3-internal",
        "scripts/**",
        "vendor/**"
      ],
      "required_context": [
        "prompts/gd-review-standard.md",
        "templates/gd-step-plan-template.md",
        "templates/gd-task-packet-template.md",
        "scripts/gd-codex-bridge-review.py",
        "scripts/gd-review-controller.py",
        "scripts/gd-validate-review-content-evidence.py",
        "scripts/gd-validate-execution-outcome.py",
        "vendor/l3-transport/scripts/review-result-writer.sh"
      ],
      "deliverables": [
        {
          "path": "plans/gd/2026-06-16-fix-review-chain-bugs/proposals/shared-infra/proposal.md",
          "kind": "file",
          "must_exist": true
        }
      ],
      "blocked_by": [],
      "can_parallel_with": ["t2-l3-internal"],
      "sc_refs": ["SC-1"],
      "verify": [
        {
          "sc_ref": "SC-1",
          "method": "command",
          "cmd": "python3 scripts/gd-validate-child-proposal.py plans/gd/2026-06-16-fix-review-chain-bugs/proposals/shared-infra/proposal.md",
          "expect": "校验通过"
        }
      ]
    },
    {
      "track_id": "t2-l3-internal",
      "mode": "plan",
      "agent_role": "child_planner",
      "owned_paths": [
        "plans/gd/2026-06-16-fix-review-chain-bugs/proposals/l3-internal"
      ],
      "forbidden_paths": [
        "/Users/praise/.claude/**",
        "plans/gd/2026-06-16-fix-review-chain-bugs/proposals/shared-infra",
        "scripts/**",
        "vendor/**"
      ],
      "required_context": [
        "prompts/gd-review-standard.md",
        "templates/gd-step-plan-template.md",
        "templates/gd-task-packet-template.md",
        "scripts/gd-review-merge-and-fix-loop.py",
        "scripts/gd-review-router.py",
        "scripts/gd-review-suite-controller.py",
        "scripts/gd-validate-parent-close-gate.py",
        "scripts/gd-validate-stage-dispatch-ledger.py"
      ],
      "deliverables": [
        {
          "path": "plans/gd/2026-06-16-fix-review-chain-bugs/proposals/l3-internal/proposal.md",
          "kind": "file",
          "must_exist": true
        }
      ],
      "blocked_by": [],
      "can_parallel_with": ["t1-shared-infra"],
      "sc_refs": ["SC-2"],
      "verify": [
        {
          "sc_ref": "SC-2",
          "method": "command",
          "cmd": "python3 scripts/gd-validate-child-proposal.py plans/gd/2026-06-16-fix-review-chain-bugs/proposals/l3-internal/proposal.md",
          "expect": "校验通过"
        }
      ]
    }
  ],
  "waves": [
    {
      "wave_id": "w1",
      "track_ids": ["t1-shared-infra", "t2-l3-internal"],
      "description": "并行派发 2 个 child planner：t1 规划共享组件+传输层修复，t2 规划 L3-only+L2 修复；owned_paths 不重叠。"
    }
  ],
  "merge_gates": [
    {
      "gate_id": "G1",
      "description": "每个 child proposal 通过 gd-validate-child-proposal.py（schema + anti-fill）"
    },
    {
      "gate_id": "G2",
      "description": "child proposal 的 task_packets.owned_paths 不越出本 track 责任文件集"
    },
    {
      "gate_id": "G3",
      "description": "两 track 的 task_packet 责任文件无重叠（共享组件只归 t1）"
    },
    {
      "gate_id": "G4",
      "description": "每条 SC 绑定可执行 verify（command/path/test），无 anti-fill 占位词"
    },
    {
      "gate_id": "G5",
      "description": "并行 wave w1 两 child 全完成后主 agent 才合并写 master-plan"
    },
    {
      "gate_id": "G6",
      "description": "两 proposal 对同一病灶给出冲突修法时主 agent 在 master-plan 写仲裁理由"
    }
  ]
}
